Topic Id,Top Words...
0,don witch amy arthur orchard make doesn march young made set ve posts warren towns end joe bye gnawed huse
1,day wind moon earth white stone stay song gold bird blue snow singing leaf sun cold flowers air star spoke
2,house chimney star fire thing ground telescope build stars things farm grindstone hand heard blade wheel apple satisfied talk brad
3,paul wife murphy log called hollow length ashamed question load girl drink slowly pond grease sawyer pine camp light water
4,back made tree thought good left make life maple end man don night time put stood place long hands found
5,door cellar toffile bones _ attic bed _mother mother bedroom don _son knock grave floor open stairs son night hand
6,grapes laban eliza grave dead brother lie sister cared birch gathered heart poor grief time ll shake grape fall awhile
7,hampshire mountains state choose gold farm massachusetts vermont met long lofty laughs york laugh sell nature people man asked puke
8,books show window people house find stone brook fountain year miles heart woods ll mountain poetess sill forever men glass
9,axe baptiste wall love strength hand head rough long night sweet education curves alder helve passed woods measure blew knew
